{
  "$schema": "https://json-schema.org/draft/2020-12/schema",
  "$id": "https://arcbox.local/tactics/lore/schema/voices.schema.json",
  "title": "Player voice set",
  "description": "voices/<id>.json: a voice a player picks for their character in the creator, with the battle and camp lines it speaks. Player characters are made by players, so their barks belong to a voice set rather than a named speaker.",
  "type": "object",
  "properties": {
    "id": { "$ref": "common.schema.json#/$defs/id" },
    "replaces": { "$ref": "common.schema.json#/$defs/replaces" },
    "name": { "$ref": "common.schema.json#/$defs/text", "description": "Shown in the creator, e.g. 'Steady'." },
    "description": { "$ref": "common.schema.json#/$defs/text", "description": "The personality, for the creator and for casting." },
    "voice": {
      "type": "object",
      "properties": {
        "theme": { "type": "string", "pattern": "^[a-z][a-z0-9_.-]*$" },
        "direction": { "$ref": "common.schema.json#/$defs/text", "description": "Casting and TTS brief. Each set should be performable in a higher and a lower register." }
      },
      "required": ["direction"],
      "additionalProperties": false
    },
    "events": { "$ref": "common.schema.json#/$defs/barkEvents" }
  },
  "required": ["id", "name", "description", "voice", "events"],
  "additionalProperties": false
}
